{
  "kind": "crossroads",
  "id": "xr.arthur-thurston",
  "name": "Arthur Thurston",
  "survivor": "sv.arthur-thurston",
  "mature": false,
  "trigger": {
    "point": "action.search",
    "when": {
      "all": [
        {
          "test": "survivorIs",
          "subject": "survivor",
          "value": "sv.arthur-thurston"
        },
        {
          "not": {
            "test": "seatIsExiled",
            "subject": "seat"
          }
        }
      ]
    }
  },
  "options": [
    {
      "id": "burn",
      "effect": [
        {
          "op": "wound",
          "count": 2,
          "kind": "wound",
          "scope": {
            "who": "survivor"
          }
        }
      ]
    },
    {
      "id": "shoot",
      "effect": [
        {
          "op": "morale",
          "value": -1
        }
      ]
    }
  ],
  "text": {
    "trigger": "Arthur searches.",
    "vignette": "The house is full of small, filthy children who do not speak, and one of them is holding his wrist with a very strong grip. More little hands are reaching out of the dark.",
    "options": {
      "burn": "Use a lighter to scare them off. Arthur takes two wounds.",
      "shoot": "Fire into the dark. The kids scatter and something in the colony breaks. Morale drops by 1."
    }
  },
  "sources": {
    "trigger": "BGG crossroads-v1.1",
    "options": "BGG crossroads-v1.1",
    "mature": "BGG crossroads-v1.1 (verify)"
  },
  "status": "draft",
  "notes": "src: Crossroad_cards_v1.1 card #17. "
}
